367	ἰπούμενος ῥίζαισιν Αἰτναίαις ὕπο·
368	κορυφαῖς δʼ ἐν ἄκραις ἥμενος μυδροκτυπεῖ
369	Ἥφαιστος· ἔνθεν ἐκραγήσονταί ποτε
370	ποταμοὶ πυρὸς δάπτοντες ἀγρίαις γνάθοις
371	τῆς καλλικάρπου Σικελίας λευροὺς γύας·
372	τοιόνδε Τυφὼς ἐξαναζέσει χόλον
373	θερμοῖς ἀπλάτου βέλεσι πυρπνόου ζάλης,
374	καίπερ κεραυνῷ Ζηνὸς ἠνθρακωμένος.
375	σὺ δʼ οὐκ ἄπειρος, οὐδʼ ἐμοῦ διδασκάλου
376	χρῄζεις· σεαυτὸν σῷζʼ ὅπως ἐπίστασαι·
377	ἐγὼ δὲ τὴν παροῦσαν ἀντλήσω τύχην,
378	ἔστʼ ἂν Διὸς φρόνημα λωφήσῃ χόλου.
379	οὔκουν, Προμηθεῦ, τοῦτο γιγνώσκεις, ὅτι
380	ὀργῆς νοσούσης εἰσὶν ἰατροὶ λόγοι;
381	ἐάν τις ἐν καιρῷ γε μαλθάσσῃ κέαρ
382	καὶ μὴ σφριγῶντα θυμὸν ἰσχναίνῃ βίᾳ.
383	ἐν τῷ προθυμεῖσθαι δὲ καὶ τολμᾶν τίνα
384	ὁρᾷς ἐνοῦσαν ζημίαν; δίδασκέ με.
385	μόχθον περισσὸν κουφόνουν τʼ εὐηθίαν.
386	ἔα με τῇδε τῇ νόσῳ νοσεῖν, ἐπεὶ
387	κέρδιστον εὖ φρονοῦντα μὴ φρονεῖν δοκεῖν.
388	ἐμὸν δοκήσει τἀμπλάκημʼ εἶναι τόδε.
389	σαφῶς μʼ ἐς οἶκον σὸς λόγος στέλλει πάλιν.
390	μὴ γάρ σε θρῆνος οὑμὸς εἰς ἔχθραν βάλῃ.
391	ἦ τῷ νέον θακοῦντι παγκρατεῖς ἕδρας;
392	τούτου φυλάσσου μή ποτʼ ἀχθεσθῇ κέαρ.
393	ἡ σή, Προμηθεῦ, συμφορὰ διδάσκαλος.
394	στέλλου, κομίζου, σῷζε τὸν παρόντα νοῦν.
395	ὁρμωμένῳ μοι τόνδʼ ἐθώυξας λόγον.
396	λευρὸν γὰρ οἷμον αἰθέρος ψαίρει πτεροῖς
397	τετρασκελὴς οἰωνός· ἄσμενος δέ τἂν
398	σταθμοῖς ἐν οἰκείοισι κάμψειεν γόνυ.
399	στένω σε τᾶς οὐλομένας τύχας, Προμηθεῦ·
400	δακρυσίστακτα δʼ ἀπʼ ὄσσων
401	ῥαδινὰν λειβομένα ῥέος παρειὰν
402	νοτίοις ἔτεγξα παγαῖς·
403	ἀμέγαρτα γὰρ τάδε Ζεὺς
404	ἰδίοις νόμοις κρατύνων
405	ὑπερήφανον θεοῖς τοῖς
406	πάρος ἐνδείκνυσιν αἰχμάν.
407	πρόπασα δʼ ἤδη στονόεν λέλακε χώρα,
408	μεγαλοσχήμονά ἀρχαι-
409	οπρεπῆ στένουσι τὰν σὰν
410	ξυνομαιμόνων τε τιμάν,
411	ὁπόσοι τʼ ἔποικον ἁγνᾶς
412	Ἀσίας ἕδος νέμονται,
413	μεγαλοστόνοισι σοῖς πή-
414	μασι συγκάμνουσι θνατοί.
415	Κολχίδος τε γᾶς ἔνοικοι
416	παρθένοι, μάχας ἄτρεστοι,
417	καὶ Σκύθης ὅμιλος, οἳ γᾶς
418	ἔσχατον τόπον ἀμφὶ Μαι-
419	ῶτιν ἔχουσι λίμναν,
420	Ἀραβίας τʼ ἄρειον ἄνθος,
421	ὑψίκρημνον οἳ πόλισμα
422	Καυκάσου πέλας νέμονται,
423	δάιος στρατός, ὀξυπρῴ-
424	ροισι βρέμων ἐν αἰχμαῖς.
425	μόνον δὴ πρόσθεν ἄλλον ἐν πόνοις
426	δαμέντʼ ἀδαμαντοδέτοις
427	Τιτᾶνα λύμαις εἰσιδόμαν, θεόν,
428	Ἄτλαντος αἰὲν ; ὑπέροχον σθένος κραταιόν,
429	ὃς οὐράνιόν τε πόλον
430	νώτοις στέγων ὑποστενάζει.
431	βοᾷ δὲ πόντιος κλύδων
432	ξυμπίτνων, στένει βυθός,
433	κελαινὸς δʼ Ἄιδος ὑποβρέμει μυχὸς γᾶς,
434	παγαί θʼ ἁγνορύτων ποταμῶν
435	στένουσιν ἄλγος οἰκτρόν.
436	μή τοι χλιδῇ δοκεῖτε μηδʼ αὐθαδίᾳ
437	σιγᾶν με· συννοίᾳ δὲ δάπτομαι κέαρ,
438	ὁρῶν ἐμαυτὸν ὧδε προυσελούμενον.
439	καίτοι θεοῖσι τοῖς νέοις τούτοις γέρα
440	τίς ἄλλος ἢ ʼγὼ παντελῶς διώρισεν;
441	ἀλλʼ αὐτὰ σιγῶ· καὶ γὰρ εἰδυίαισιν ἂν
442	ὑμῖν λέγοιμι· τἀν βροτοῖς δὲ πήματα
443	ἀκούσαθʼ, ὥς σφας νηπίους ὄντας τὸ πρὶν
444	ἔννους ἔθηκα καὶ φρενῶν ἐπηβόλους.
445	λέξω δέ, μέμψιν οὔτινʼ ἀνθρώποις ἔχων,
446	ἀλλʼ ὧν δέδωκʼ εὔνοιαν ἐξηγούμενος·
447	οἳ πρῶτα μὲν βλέποντες ἔβλεπον μάτην,
448	κλύοντες οὐκ ἤκουον, ἀλλʼ ὀνειράτων
449	ἀλίγκιοι μορφαῖσι τὸν μακρὸν βίον
450	ἔφυρον εἰκῇ πάντα, κοὔτε πλινθυφεῖς
451	δόμους προσείλους, ᾖσαν, οὐ ξυλουργίαν·
452	κατώρυχες δʼ ἔναιον ὥστʼ ἀήσυροι
453	μύρμηκες ἄντρων ἐν μυχοῖς ἀνηλίοις.
454	ἦν δʼ οὐδὲν αὐτοῖς οὔτε χείματος τέκμαρ
455	οὔτʼ ἀνθεμώδους ἦρος οὔτε καρπίμου
456	θέρους βέβαιον, ἀλλʼ ἄτερ γνώμης τὸ πᾶν
457	ἔπρασσον, ἔστε δή σφιν ἀντολὰς ἐγὼ
458	ἄστρων ἔδειξα τάς τε δυσκρίτους δύσεις.
459	καὶ μὴν ἀριθμόν, ἔξοχον σοφισμάτων,
460	ἐξηῦρον αὐτοῖς, γραμμάτων τε συνθέσεις,
461	μνήμην ἁπάντων, μουσομήτορʼ ἐργάνην.
462	κἄζευξα πρῶτος ἐν ζυγοῖσι κνώδαλα
463	ζεύγλαισι δουλεύοντα σάγμασὶν θʼ, ὅπως
464	θνητοῖς μεγίστων διάδοχοι μοχθημάτων
465	γένοινθʼ , ὑφʼ ἅρμα τʼ ἤγαγον φιληνίους
466	ἵππους, ἄγαλμα τῆς ὑπερπλούτου χλιδῆς.
467	θαλασσόπλαγκτα δʼ οὔτις ἄλλος ἀντʼ ἐμοῦ
468	λινόπτερʼ ηὗρε ναυτίλων ὀχήματα.
469	τοιαῦτα μηχανήματʼ ἐξευρὼν τάλας
470	βροτοῖσιν, αὐτὸς οὐκ ἔχω σόφισμʼ ὅτῳ
471	τῆς νῦν παρούσης πημονῆς ἀπαλλαγῶ.
472	πέπονθας αἰκὲς πῆμʼ· ἀποσφαλεὶς φρενῶν
473	πλανᾷ, κακὸς δʼ ἰατρὸς ὥς τις ἐς νόσον
474	πεσὼν ἀθυμεῖς καὶ σεαυτὸν οὐκ ἔχεις
475	εὑρεῖν ὁποίοις φαρμάκοις ἰάσιμος.
476	τὰ λοιπά μου κλύουσα θαυμάσῃ πλέον,
477	οἵας τέχνας τε καὶ πόρους ἐμησάμην.
478	τὸ μὲν μέγιστον, εἴ τις ἐς νόσον πέσοι,
479	οὐκ ἦν ἀλέξημʼ οὐδέν, οὔτε βρώσιμον,
480	οὐ χριστόν, οὐδὲ πιστόν, ἀλλὰ φαρμάκων
481	χρείᾳ κατεσκέλλοντο, πρίν γʼ ἐγώ σφισιν
482	ἔδειξα κράσεις ἠπίων ἀκεσμάτων,
483	αἷς τὰς ἁπάσας ἐξαμύνονται νόσους.
484	τρόπους τε πολλοὺς μαντικῆς ἐστοίχισα,
485	κἄκρινα πρῶτος ἐξ ὀνειράτων ἃ χρὴ
486	ὕπαρ γενέσθαι, κληδόνας τε δυσκρίτους
487	ἐγνώρισʼ αὐτοῖς ἐνοδίους τε συμβόλους·
488	γαμψωνύχων τε πτῆσιν οἰωνῶν σκεθρῶς
489	διώρισʼ, οἵτινές τε δεξιοὶ φύσιν
490	εὐωνύμους τε, καὶ δίαιταν ἥντινα
491	ἔχουσʼ ἕκαστοι, καὶ πρὸς ἀλλήλους τίνες
492	ἔχθραι τε καὶ στέργηθρα καὶ συνεδρίαι·
493	σπλάγχνων τε λειότητα, καὶ χροιὰν τίνα
494	ἔχουσʼ ἂν εἴη δαίμοσιν πρὸς ἡδονὴν
495	χολή, λοβοῦ τε ποικίλην εὐμορφίαν.
496	κνίσῃ τε κῶλα συγκαλυπτὰ καὶ μακρὰν
497	ὀσφῦν πυρώσας δυστέκμαρτον ἐς τέχνην
498	ὥδωσα θνητούς, καὶ φλογωπὰ σήματα
499	ἐξωμμάτωσα, πρόσθεν ὄντʼ ἐπάργεμα.
500	τοιαῦτα μὲν δὴ ταῦτʼ· ἔνερθε δὲ χθονὸς
501	κεκρυμμένʼ, ἀνθρώποισιν ὠφελήματα,
502	χαλκόν, σίδηρον, ἄργυρον, χρυσόν τε τίς
503	φήσειεν ἂν πάροιθεν ἐξευρεῖν ἐμοῦ;
504	οὐδείς, σάφʼ οἶδα, μὴ μάτην φλύσαι θέλων.
505	βραχεῖ δὲ μύθῳ πάντα συλλήβδην μάθε,
506	πᾶσαι τέχναι βροτοῖσιν ἐκ Προμηθέως.
507	μή νυν βροτοὺς μὲν ὠφέλει καιροῦ πέρα,
508	σαυτοῦ δʼ ἀκήδει δυστυχοῦντος. ὡς ἐγὼ
509	εὔελπίς εἰμι τῶνδέ σʼ ἐκ δεσμῶν ἔτι
510	λυθέντα μηδὲν μεῖον ἰσχύσειν Διός.
511	οὐ ταῦτα ταύτῃ Μοῖρά πω τελεσφόρος
512	κρᾶναι πέπρωται, μυρίαις δὲ πημοναῖς
513	δύαις τε καμφθεὶς ὧδε δεσμὰ φυγγάνω·
514	τέχνη δʼ ἀνάγκης ἀσθενεστέρα μακρῷ.
515	τίς οὖν ἀνάγκης ἐστὶν οἰακοστρόφος;
516	Μοῖραι τρίμορφοι μνήμονές τʼ Ἐρινύες
517	τούτων ἄρα Ζεύς ἐστιν ἀσθενέστερος;
518	οὔκουν ἂν ἐκφύγοι γε τὴν πεπρωμένην.
519	τί γὰρ πέπρωται Ζηνὶ πλὴν ἀεὶ κρατεῖν;
520	τοῦτʼ οὐκέτʼ ἂν πύθοιο μηδὲ λιπάρει.
521	ἦ πού τι σεμνόν ἐστιν ὃ ξυναμπέχεις.
522	ἄλλου λόγου μέμνησθε, τόνδε δʼ οὐδαμῶς
523	καιρὸς γεγωνεῖν, ἀλλὰ συγκαλυπτέος
524	ὅσον μάλιστα· τόνδε γὰρ σῴζων ἐγὼ
525	δεσμοὺς ἀεικεῖς καὶ δύας ἐκφυγγάνω.
526	μηδάμʼ ὁ πάντα νέμων
527	θεῖτʼ ἐμᾷ γνώμᾳ κράτος ἀντίπαλον Ζεύς,
530	μηδʼ ἐλινύσαιμι θεοὺς ὁσίαις θοίναις ποτινισομένα
531	βουφόνοις παρʼ Ὠκεανοῦ πατρὸς ἄσβεστον πόρον,
535	μηδʼ ἀλίτοιμι λόγοις·
536	ἀλλά μοι τόδʼ ἐμμένοι καὶ μήποτʼ ἐκτακείη·
537	ἁδύ τι θαρσαλέαις
538	τὸν μακρὸν τείνειν βίον ἐλπίσι, φαναῖς
539	θυμὸν ἀλδαίνουσαν ἐν εὐφροσύναις. φρίσ-
540	σω δέ σε δερκομένα
541	μυρίοις μόχθοις διακναιόμενον .
542	Ζῆνα γὰρ οὐ τρομέων
543	ἰδίᾳ γνώμᾳ σέβῃ θνατοὺς ἄγαν, Προμηθεῦ.
545	φέρʼ, ὅπως ἄχαρις χάρις, ὦ φίλος·
546	εἰπὲ ποῦ τίς ἀλκά;
547	τίς ἐφαμερίων ἄρηξις; οὐδʼ ἐδέρχθης
548	ὀλιγοδρανίαν ἄκικυν,
549	ἰσόνειρον, ᾇ τὸ φωτῶν
550	ἀλαὸν γένος ἐμπεποδισμένον; οὔποτε 
551	τὰν Διὸς ἁρμονίαν θνατῶν παρεξίασι βουλαί.
552	ἔμαθον τάδε σὰς προσιδοῦσʼ ὀλο-
553	ὰς τύχας, Προμηθεῦ.
554	τὸ διαμφίδιον δέ μοι μέλος προσέπτα
555	τόδʼ ἐκεῖνό θʼ, ὅ τʼ ἀμφὶ λουτρὰ
556	καὶ λέχος σὸν ὑμεναίουν
557	ἰότατι γάμων, ὅτε τὰν ὁμοπάτριον ἕδνοις
560	ἄγαγες Ἡσιόναν πείθὼν δάμαρτα κοινόλεκτρον.
561	τίς γῆ; τί γένος; τίνα φῶ λεύσσειν
562	τόνδε χαλινοῖς ἐν πετρίνοισιν
563	χειμαζόμενον;
564	τίνος ἀμπλακίας ποινὰς ὀλέκῃ;
565	σήμηνον ὅποι γῆς ἡ μογερὰ πεπλάνημαι.
566	ἆ ἆ, ἒ ἔ,
567	χρίει τις αὖ με τὰν τάλαιναν οἶστρος,
568	εἴδωλον Ἄργου γηγενοῦς, ἄλευʼ ἆ δᾶ· φοβοῦμαι
569	τὸν μυριωπὸν εἰσορῶσα βούταν.
570	ὁ δὲ πορεύεται δόλιον ὄμμʼ ἔχων,
570a	ὃν οὐδὲ κατθανόντα γαῖα κεύθει.
571	ἀλλʼ, ἐμὲ τὰν τάλαιναν
572	ἐξ ἐνέρων περῶν κυναγετεῖ, πλανᾷ
573	τε νῆστιν ἀνὰ τὰν παραλίαν ψάμμαν.
574	ὑπὸ δὲ κηρόπλαστος ὀτοβεῖ δόναξ
575	ἀχέτας ὑπνοδόταν νόμον·
576	ἰὼ ἰὼ πόποι, ποῖ μʼ ἄγουσι τη-
577	λέπλαγκτοι πλάναι;
578	τί ποτέ μʼ, ὦ Κρόνιε παῖ, τί ποτε ταῖσδʼ
579	ἐνέζευξας εὑρὼν ἁμαρτοῦσαν ἐν
580	πημοναῖσιν; ἓ ἕ,
581	οἰστρηλάτῳ δὲ δείματι
582	δειλαίαν παράκοπον ὧδε τείρεις;
583	πυρί με φλέξον, ἢ χθονὶ κάλυψον, ἤ
584	ποντίοις δάκεσι δὸς βοράν,
585	μηδέ μοι φθονήσῃς
586	εὐγμάτων, ἄναξ.
585a	ἄδην με πολύπλανοι πλάναι
586a	γεγυμνάκασιν, οὐδʼ ἔχω μαθεῖν ὅπα
587	πημονὰς ἀλύξω.
588	κλύεις φθέγμα τᾶς βούκερω παρθένου;
589	πῶς δʼ οὐ κλύω τῆς οἰστροδινήτου κόρης,
590	τῆς Ἰναχείας; ἣ Διὸς θάλπει κέαρ
591	ἔρωτι, καὶ νῦν τοὺς ὑπερμήκεις δρόμους
592	Ἥρᾳ στυγητὸς πρὸς βίαν γυμνάζεται.
593	πόθεν ἐμοῦ σὺ πατρὸς ὄνομʼ ἀπύεις;
594	εἰπέ μοι τᾷ μογερᾷ τίς ὤν;
595	τίς ἄρα μʼ, ὦ τάλας, τὰν τάλαιναν ὧδʼ
596	ἔτυμα προσθροεῖς;
597	θεόσυτόν τε νόσον ὠνόμασας, ἃ
598	μαραίνει με χρίουσα κέντροις, ἰώ ,
599	φοιταλέοισιν ἓ ἕ·
600	σκιρτημάτων δὲ νήστισιν
600a	αἰκείαις λαβρόσυτος ἦλθον, Ἥρας 
601	ἐπικότοισι μήδεσι δαμεῖσα. δυσ-
602	δαιμόνων δὲ τίνες οἵ, ἓ ἕ,
603	οἷʼ ἐγὼ μογοῦσιν;
604	ἀλλά μοι τορῶς
605	τέκμηρον ὅ τι μʼ ἐπαμμένει
606	παθεῖν, τί μῆχαρ, ἢ τί φάρμακον νόσου,
607	δεῖξον, εἴπερ οἶσθα·
608	θρόει, φράζε τᾷ δυσπλάνῳ παρθένῳ.
609	λέξω τορῶς σοι πᾶν ὅπερ χρῄζεις μαθεῖν,
610	οὐκ ἐμπλέκων αἰνίγματʼ, ἀλλʼ ἁπλῷ λόγῳ,
611	ὥσπερ δίκαιον πρὸς φίλους οἴγειν στόμα.
612	πυρὸς βροτοῖς δοτῆρʼ ὁρᾷς Προμηθέα.
613	ὦ κοινὸν ὠφέλημα θνητοῖσιν φανείς,
614	τλῆμον Προμηθεῦ, τοῦ δίκην πάσχεις τάδε;
615	ἁρμοῖ πέπαυμαι τοὺς ἐμοὺς θρηνῶν πόνους.
616	οὔκουν πόροις ἂν τήνδε δωρεὰν ἐμοί;
617	λέγʼ ἥντινʼ αἰτῇ· πᾶν γὰρ ἂν πύθοιό μου.
618	σήμηνον ὅστις ἐν φάραγγί σʼ ὤχμασεν.
619	βούλευμα μὲν τὸ Δῖον, Ἡφαίστου δὲ χείρ.
620	ποινὰς δὲ ποίων ἀμπλακημάτων τίνεις;
621	τοσοῦτον ἀρκῶ σοι σαφηνίσας μόνον.
622	καὶ πρός γε τούτοις τέρμα τῆς ἐμῆς πλάνης
623	δεῖξον, τίς ἔσται τῇ ταλαιπώρῳ χρόνος.
624	τὸ μὴ μαθεῖν σοι κρεῖσσον ἢ μαθεῖν τάδε.
625	μήτοι με κρύψῃς τοῦθʼ ὅπερ μέλλω παθεῖν.
626	ἀλλʼ οὐ μεγαίρω τοῦδέ σοι δωρήματος.
627	τί δῆτα μέλλεις μὴ οὐ γεγωνίσκειν τὸ πᾶν;
628	φθόνος μὲν οὐδείς, σὰς δʼ ὀκνῶ θράξαι φρένας.
629	μή μου προκήδου μᾶσσον ὡς ἐμοὶ γλυκύ.
630	ἐπεὶ προθυμῇ, χρὴ λέγειν. ἄκουε δή.
631	μήπω γε· μοῖραν δʼ ἡδονῆς κἀμοὶ πόρε.
632	τὴν τῆσδε πρῶτον ἱστορήσωμεν νόσον,
633	αὐτῆς λεγούσης τὰς πολυφθόρους τύχας·
634	τὰ λοιπὰ δʼ ἄθλων σοῦ διδαχθήτω πάρα.
635	σὸν ἔργον, Ἰοῖ, ταῖσδʼ ὑπουργῆσαι χάριν,
636	ἄλλως τε πάντως καὶ κασιγνήταις πατρός.
637	ὡς τἀποκλαῦσαι κἀποδύρασθαι τύχας
638	ἐνταῦθʼ, ὅπου μέλλοι τις οἴσεσθαι δάκρυ
639	πρὸς τῶν κλυόντων, ἀξίαν τριβὴν ἔχει.
640	οὐκ οἶδʼ ὅπως ὑμῖν ἀπιστῆσαί με χρή,
641	σαφεῖ δὲ μύθῳ πᾶν ὅπερ προσχρῄζετε
642	πεύσεσθε· καίτοι καὶ λέγουσʼ αἰσχύνομαι
643	θεόσσυτον χειμῶνα καὶ διαφθορὰν
644	μορφῆς, ὅθεν μοι σχετλίᾳ προσέπτατο.
645	αἰεὶ γὰρ ὄψεις ἔννυχοι πωλεύμεναι
646	ἐς παρθενῶνας τοὺς ἐμοὺς παρηγόρουν
647	λείοισι μύθοις ὦ μέγʼ εὔδαιμον κόρη,
648	τί παρθενεύει δαρόν, ἐξόν σοι γάμου
649	τυχεῖν μεγίστου; Ζεὺς γὰρ ἱμέρου βέλει
650	πρὸς σοῦ τέθαλπται καὶ συναίρεσθαι Κύπριν
651	θέλει· σὺ δʼ, ὦ παῖ, μὴ ʼπολακτίσῃς λέχος
652	τὸ Ζηνός, ἀλλʼ ἔξελθε πρὸς Λέρνης βαθὺν
653	λειμῶνα, ποίμνας βουστάσεις τε πρὸς πατρός,
654	ὡς ἂν τὸ Δῖον ὄμμα λωφήσῃ πόθου.
655	τοιοῖσδε πάσας εὐφρόνας ὀνείρασι
656	συνειχόμην δύστηνος, ἔστε δὴ πατρὶ
657	ἔτλην γεγωνεῖν νυκτίφοιτʼ ὀνείρατα.
658	ὁ δʼ ἔς τε Πυθὼ κἀπὶ Δωδώνης πυκνοὺς
659	θεοπρόπους ἴαλλεν, ὡς μάθοι τί χρὴ
660	δρῶντʼ ἢ λέγοντα δαίμοσιν πράσσειν φίλα.
661	ἧκον δʼ ἀναγγέλλοντες αἰολοστόμους
662	χρησμοὺς ἀσήμους δυσκρίτως τʼ εἰρημένους.
663	τέλος δʼ ἐναργὴς βάξις ἦλθεν Ἰνάχῳ
664	σαφῶς ἐπισκήπτουσα καὶ μυθουμένη
665	ἔξω δόμων τε καὶ πάτρας ὠθεῖν ἐμέ,
666	ἄφετον ἀλᾶσθαι γῆς ἐπʼ ἐσχάτοις ὅροις·
667	κεἰ μὴ θέλοι, πυρωπὸν ἐκ Διὸς μολεῖν
668	κεραυνόν, ὃς πᾶν ἐξαϊστώσοι γένος.
669	τοιοῖσδε πεισθεὶς Λοξίου μαντεύμασιν
670	ἐξήλασέν με κἀπέκλῃσε δωμάτων
671	ἄκουσαν ἄκων· ἀλλʼ ἐπηνάγκαζέ νιν
672	Διὸς χαλινὸς πρὸς βίαν πράσσειν τάδε.
673	εὐθὺς δὲ μορφὴ καὶ φρένες διάστροφοι
674	ἦσαν, κεραστὶς δʼ, ὡς ὁρᾶτʼ, ὀξυστόμῳ
675	μύωπι χρισθεῖσʼ ἐμμανεῖ σκιρτήματι
676	ᾖσσον πρὸς εὔποτόν τε Κερχνείας ῥέος
677	Λέρνης τε κρήνην · βουκόλος δὲ γηγενὴς
678	ἄκρατος ὀργὴν Ἄργος ὡμάρτει, πυκνοῖς
679	ὄσσοις δεδορκὼς τοὺς ἐμοὺς κατὰ στίβους.
680	ἀπροσδόκητος δʼ αὐτὸν ἀφνίδιος μόρος
681	τοῦ ζῆν ἀπεστέρησεν. οἰστροπλὴξ δʼ ἐγὼ
682	μάστιγι θείᾳ γῆν πρὸ γῆς ἐλαύνομαι.
683	κλύεις τὰ πραχθέντʼ· εἰ δʼ ἔχεις εἰπεῖν ὅ τι
684	λοιπὸν πόνων, σήμαινε· μηδέ μʼ οἰκτίσας
685	ξύνθαλπε μύθοις ψευδέσιν· νόσημα γὰρ
686	αἴσχιστον εἶναί φημι συνθέτους λόγους.
687	ἔα ἔα, ἄπεχε, φεῦ·
688	οὔποτʼ οὔποτʼ ηὔχουν ὧδε ξένους
689	μολεῖσθαι λόγους εἰς ἀκοὰν ἐμάν,
690	οὐδʼ ὧδε δυσθέατα καὶ δύσοιστα
691	πήματα, λύματα, δείματα ἀμ-
692	φάκει κέντρῳ τύψειν ψυχὰν ἐμάν.
693	ἰὼ ἰὼ μοῖρα μοῖρα,
695	πέφρικʼ εἰσιδοῦσα πρᾶξιν Ἰοῦς.
696	πρῴ γε στενάζεις καὶ φόβου πλέα τις εἶ·
697	ἐπίσχες ἔστʼ ἂν καὶ τὰ λοιπὰ προσμάθῃς.
698	λέγʼ, ἐκδίδασκε· τοῖς νοσοῦσί τοι γλυκὺ
699	τὸ λοιπὸν ἄλγος προυξεπίστασθαι τορῶς.
700	τὴν πρίν γε χρείαν ἠνύσασθʼ ἐμοῦ πάρα
701	κούφως· μαθεῖν γὰρ τῆσδε πρῶτʼ ἐχρῄζετε
702	τὸν ἀμφʼ ἑαυτῆς ἆθλον ἐξηγουμένης·
703	τὰ λοιπὰ νῦν ἀκούσαθʼ, οἷα χρὴ πάθη
704	τλῆναι πρὸς Ἥρας τήνδε τὴν νεάνιδα.
705	σύ τʼ Ἰνάχειον σπέρμα, τοὺς ἐμοὺς λόγους
706	θυμῷ βάλʼ, ὡς ἂν τέρματʼ ἐκμάθῃς ὁδοῦ.
707	πρῶτον μὲν ἐνθένδʼ ἡλίου πρὸς ἀντολὰς
708	στρέψασα σαυτὴν στεῖχʼ ἀνηρότους γύας·
709	Σκύθας δʼ ἀφίξῃ νομάδας, οἳ πλεκτὰς στέγας
710	πεδάρσιοι ναίουσʼ ἐπʼ εὐκύκλοις ὄχοις
711	ἑκηβόλοις τόξοισιν ἐξηρτυμένοι·
712	οἷς μὴ πελάζειν, ἀλλʼ ἁλιστόνοις πόδας
713	χρίμπτουσα ῥαχίαισιν ἐκπερᾶν χθόνα.
714	λαιᾶς δὲ χειρὸς οἱ σιδηροτέκτονες
715	οἰκοῦσι Χάλυβες, οὓς φυλάξασθαί σε χρή.
716	ἀνήμεροι γὰρ οὐδὲ πρόσπλατοι ξένοις.
717	ἥξεις δʼ Ὑβριστὴν ποταμὸν οὐ ψευδώνυμον,
718	ὃν μὴ περάσῃς, οὐ γὰρ εὔβατος περᾶν,
719	πρὶν ἂν πρὸς αὐτὸν Καύκασον μόλῃς, ὀρῶν
720	ὕψιστον, ἔνθα ποταμὸς ἐκφυσᾷ μένος
721	κροτάφων ἀπʼ αὐτῶν. ἀστρογείτονας δὲ χρὴ
722	κορυφὰς ὑπερβάλλουσαν ἐς μεσημβρινὴν
723	βῆναι κέλευθον, ἔνθʼ, Ἀμαζόνων στρατὸν
724	ἥξεις στυγάνορʼ, αἳ Θεμίσκυράν ποτε
725	κατοικιοῦσιν ἀμφὶ Θερμώδονθʼ, ἵνα
726	τραχεῖα πόντου Σαλμυδησσία γνάθος
727	ἐχθρόξενος ναύταισι, μητρυιὰ νεῶν·
728	αὗταί σʼ ὁδηγήσουσι καὶ μάλʼ ἀσμένως.
729	ἰσθμὸν δʼ ἐπʼ αὐταῖς στενοπόροις λίμνης πύλαις
730	Κιμμερικὸν ἥξεις, ὃν θρασυσπλάγχνως σε χρὴ
731	λιποῦσαν αὐλῶνʼ ἐκπερᾶν Μαιωτικόν·
732	ἔσται δὲ θνητοῖς εἰσαεὶ λόγος μέγας
733	τῆς σῆς πορείας, Βόσπορος δʼ ἐπώνυμος
734	κεκλήσεται. λιποῦσα δʼ Εὐρώπης πέδον
735	ἤπειρον ἥξεις Ἀσιάδʼ·. ἆρʼ, ὑμῖν δοκεῖ
736	ὁ τῶν θεῶν τύραννος ἐς τὰ πάνθʼ ὁμῶς
737	βίαιος εἶναι; τῇδε γὰρ θνητῇ θεὸς
738	χρῄζων μιγῆναι τάσδʼ ἐπέρριψεν πλάνας.
739	πικροῦ δʼ ἔκυρσας, ὦ κόρη, τῶν σῶν γάμων
