740	μνηστῆρος. οὓς γὰρ νῦν ἀκήκοας λόγους,
741	εἶναι δόκει σοι μηδέπω ʼν προοιμίοις.
742	ἰώ μοί μοι, ἒ ἔ.
743	σὺ δʼ αὖ κέκραγας κἀναμυχθίζῃ; τί που
744	δράσεις, ὅταν τὰ λοιπὰ πυνθάνῃ κακά;
745	ἦ γάρ τι λοιπὸν τῇδε πημάτων ἐρεῖς;
746	δυσχείμερόν γε πέλαγος ἀτηρᾶς δύης.
747	τί δῆτʼ ἐμοὶ ζῆν κέρδος, ἀλλʼ οὐκ ἐν τάχει
748	ἔρριψʼ ἐμαυτὴν τῆσδʼ ἀπὸ στύφλου πέτρας,
749	ὅπως πέδοι σκήψασα τῶν πάντων πόνων
750	ἀπηλλάγην; κρεῖσσον γὰρ εἰσάπαξ θανεῖν
751	ἢ τὰς ἁπάσας ἡμέρας πάσχειν κακῶς.
752	ἦ δυσπετῶς ἂν τοὺς ἐμοὺς ἄθλους φέροις,
753	ὅτῳ θανεῖν μέν ἐστιν οὐ πεπρωμένον·
754	αὕτη γὰρ ἦν ἂν πημάτων ἀπαλλαγή·
755	νῦν δʼ οὐδέν ἐστι τέρμα μοι προκείμενον
756	μόχθων, πρὶν ἂν Ζεὺς ἐκπέσῃ τυραννίδος.
757	ἦ γάρ ποτʼ ἔστιν ἐκπεσεῖν ἀρχῆς Δία;
758	ἥδοιʼ ἄν, οἶμαι, τήνδʼ ἰδοῦσα συμφοράν.
759	πῶς δʼ οὐκ ἄν, ἥτις ἐκ Διὸς πάσχω κακῶς;
760	ὡς τοίνυν ὄντων τῶνδέ σοι μαθεῖν πάρα.
761	πρὸς τοῦ τύραννα σκῆπτρα συληθήσεται;
762	πρὸς αὐτὸς αὑτοῦ κενοφρόνων βουλευμάτων.
763	ποίῳ τρόπῳ; σήμηνον, εἰ μή τις βλάβη.
764	γαμεῖ γάμον τοιοῦτον ᾧ ποτʼ ἀσχαλᾷ.
765	θέορτον, ἢ βρότειον; εἰ ῥητόν, φράσον.
766	τί δʼ ὅντινʼ·; οὐ γὰρ ῥητὸν αὐδᾶσθαι τόδε.
767	ἦ πρὸς δάμαρτος ἐξανίσταται θρόνων;
768	ἣ τέξεταί γε παῖδα φέρτερον πατρός.
769	οὐδʼ ἔστιν αὐτῷ τῆσδʼ ἀποστροφὴ τύχης;
770	οὐ δῆτα, πλὴν ἔγωγʼ ἂν ἐκ δεσμῶν λυθείς.
771	τίς οὖν ὁ λύσων ἐστὶν ἄκοντος Διός;
772	τῶν σῶν τινʼ αὐτὸν ἐγγόνων εἶναι χρεών.
773	πῶς εἶπας; ἦ ʼμὸς παῖς σʼ ἀπαλλάξει κακῶν;
774	τρίτος γε γένναν πρὸς δέκʼ ἄλλαισιν γοναῖς.
775	ἥδʼ οὐκέτʼ εὐξύμβλητος ἡ χρησμῳδία.
776	καὶ μηδὲ σαυτῆς ἐκμαθεῖν ζήτει πόνους.
777	μή μοι προτείνων κέρδος εἶτʼ ἀποστέρει.
778	δυοῖν λόγοιν σε θατέρῳ δωρήσομαι.
779	ποίοιν; πρόδειξον, αἵρεσίν τʼ ἐμοὶ δίδου.
780	δίδωμʼ· ἑλοῦ γάρ, ἢ πόνων τὰ λοιπά σοι
781	φράσω σαφηνῶς, ἢ τὸν ἐκλύσοντʼ ἐμέ.
782	τούτων σὺ τὴν μὲν τῇδε, τὴν δʼ ἐμοὶ χάριν
783	θέσθαι θέλησον, μηδʼ ἀτιμάσῃς λόγου·
784	καὶ τῇδε μὲν γέγωνε τὴν λοιπὴν πλάνην,
785	ἐμοὶ δὲ τὸν λύσοντα· τοῦτο γὰρ ποθῶ.
786	ἐπεὶ προθυμεῖσθʼ, οὐκ ἐναντιώσομαι
787	τὸ μὴ οὐ γεγωνεῖν πᾶν ὅσον προσχρῄζετε.
788	σοὶ πρῶτον, Ἰοῖ, πολύδονον πλάνην φράσω,
789	ἣν ἐγγράφου σὺ μνήμοσιν δέλτοις φρενῶν.
790	ὅταν περάσῃς ῥεῖθρον ἠπείροιν ὅρον,
791	πρὸς ἀντολὰς φλογῶπας ἡλιοστιβεῖς
792	
793	πόντου περῶσα φλοῖσβον, ἔστʼ ἂν ἐξίκῃ
794	πρὸς Γοργόνεια πεδία Κισθήνης, ἵνα
795	αἱ Φορκίδες ναίουσι δηναιαὶ κόραι
795a	τρεῖς κυκνόμορφοι, κοινὸν ὄμμʼ ἐκτημέναι,
796	μονόδοντες, ἃς οὔθʼ ἥλιος προσδέρκεται
797	ἀκτῖσιν οὔθʼ ἡ νύκτερος μήνη ποτέ.
798	πέλας δʼ ἀδελφαὶ τῶνδε τρεῖς κατάπτεροι,
799	δρακοντόμαλλοι Γοργόνες βροτοστυγεῖς,
800	ἃς θνητὸς οὐδεὶς εἰσιδὼν ἕξει πνοάς.
801	τοιοῦτο μέν σοι τοῦτο φρούριον λέγω·
802	ἄλλην δʼ ἄκουσον δυσχερῆ θεωρίαν·
803	ὀξυστόμους γὰρ Ζηνὸς ἀκραγεῖς κύνας
804	γρῦπας φύλαξαι, τόν τε μουνῶπα στρατὸν
805	Ἀριμασπὸν ἱπποβάμονʼ, οἳ χρυσόρρυτον
806	οἰκοῦσιν ἀμφὶ νᾶμα Πλούτωνος πόρου·
807	τούτοις σὺ μὴ πέλαζε. τηλουρὸν δὲ γῆν
808	ἥξεις, κελαινὸν φῦλον, οἳ πρὸς ἡλίου
809	ναίουσι πηγαῖς, ἔνθα ποταμὸς Αἰθίοψ.
810	τούτου παρʼ ὄχθας ἕρφʼ, ἕως ἂν ἐξίκῃ
811	καταβασμόν, ἔνθα Βιβλίνων ὀρῶν ἄπο
812	ἵησι σεπτὸν Νεῖλος εὔποτον ῥέος.
813	οὗτός σʼ ὁδώσει τὴν τρίγωνον ἐς χθόνα
814	Νειλῶτιν, οὗ δὴ τὴν μακρὰν ἀποικίαν,
815	Ἰοῖ, πέπρωται σοί τε καὶ τέκνοις κτίσαι.
816	τῶν δʼ εἴ τί σοι ψελλόν τε καὶ δυσεύρετον,
817	ἐπανδίπλαζε καὶ σαφῶς ἐκμάνθανε·
818	σχολὴ δὲ πλείων ἢ θέλω πάρεστί μοι.
819	εἰ μέν τι τῇδε λοιπὸν ἢ παρειμένον
820	ἔχεις γεγωνεῖν τῆς πολυφθόρου πλάνης,
821	λέγʼ· εἰ δὲ πάντʼ εἴρηκας, ἡμῖν αὖ χάριν
822	δὸς ἥνπερ αἰτούμεσθα, μέμνησαι δέ που.
823	τὸ πᾶν πορείας ἥδε τέρμʼ ἀκήκοεν.
824	ὅπως δʼ ἂν εἰδῇ μὴ μάτην κλύουσά μου,
825	ἃ πρὶν μολεῖν δεῦρʼ ἐκμεμόχθηκεν φράσω,
826	τεκμήριον τοῦτʼ αὐτὸ δοὺς μύθων ἐμῶν.
827	ὄχλον μὲν οὖν τὸν πλεῖστον ἐκλείψω λόγων,
828	πρὸς αὐτὸ δʼ εἶμι τέρμα σῶν πλανημάτων.
829	ἐπεὶ γὰρ ἦλθες πρὸς Μολοσσὰ γάπεδα,
830	τὴν αἰπύνωτόν τʼ ἀμφὶ Δωδώνην, ἵνα
831	μαντεῖα θᾶκός τʼ ἐστὶ Θεσπρωτοῦ Διός,
832	τέρας τʼ ἄπιστον, αἱ προσήγοροι δρύες,
833	ὑφʼ ὧν σὺ λαμπρῶς κοὐδὲν αἰνικτηρίως
834	προσηγορεύθης ἡ Διὸς κλεινὴ δάμαρ
835	μέλλουσʼ ἔσεσθαι. τῶνδε προσσαίνει σέ τι ;
836	ἐντεῦθεν οἰστρήσασα τὴν παρακτίαν
837	κέλευθον ᾖξας πρὸς μέγαν κόλπον Ῥέας,
838	ἀφʼ οὗ παλιμπλάγκτοισι χειμάζῃ δρόμοις·
839	χρόνον δὲ τὸν μέλλοντα πόντιος μυχός,
840	σαφῶς ἐπίστασʼ, Ἰόνιος κεκλήσεται,.
841	τῆς σῆς πορείας μνῆμα τοῖς πᾶσιν βροτοῖς.
842	σημεῖά σοι τάδʼ ἐστὶ τῆς ἐμῆς φρενός,
843	ὡς δέρκεται πλέον τι τοῦ πεφασμένου.
844	τὰ λοιπὰ δʼ ὑμῖν τῇδέ τʼ ἐς κοινὸν φράσω,
845	ἐς ταὐτὸν ἐλθὼν τῶν πάλαι λόγων ἴχνος.
846	ἔστιν πόλις Κάνωβος ἐσχάτη χθονός,
847	Νείλου πρὸς αὐτῷ στόματι καὶ προσχώματι·
848	ἐνταῦθα δή σε Ζεὺς τίθησιν ἔμφρονα
849	ἐπαφῶν ἀταρβεῖ χειρὶ καὶ θιγὼν μόνον.
850	ἐπώνυμον δὲ τῶν Διὸς γεννημάτων
851	τέξεις κελαινὸν Ἔπαφον, ὃς καρπώσεται
852	ὅσην πλατύρρους Νεῖλος ἀρδεύει χθόνα·
853	πέμπτη δʼ ἀπʼ αὐτοῦ γέννα πεντηκοντάπαις
854	πάλιν πρὸς Ἄργος οὐχ ἑκοῦσʼ ἐλεύσεται
855	θηλύσπορος, φεύγουσα συγγενῆ γάμον
856	ἀνεψιῶν· οἱ δʼ ἐπτοημένοι φρένας,
857	κίρκοι πελειῶν οὐ μακρὰν λελειμμένοι,
858	ἥξουσι θηρεύοντες οὐ θηρασίμους
859	γάμους, φθόνον δὲ σωμάτων ἕξει θεός·
860	Πελασγία δὲ δέξεται θηλυκτόνῳ
861	Ἄρει, δαμέντων νυκτιφρουρήτῳ θράσει.
862	γυνὴ γὰρ ἄνδρʼ ἕκαστον αἰῶνος στερεῖ,
863	δίθηκτον ἐν σφαγαῖσι βάψασα ξίφος·
864	τοιάδʼ ἐπʼ ἐχθροὺς τοὺς ἐμοὺς ἔλθοι Κύπρις.
865	μίαν δὲ παίδων ἵμερος θέλξει τὸ μὴ
866	κτεῖναι σύνευνον, ἀλλʼ ἀπαμβλυνθήσεται
867	γνώμην· δυοῖν δὲ θάτερον βουλήσεται,
868	κλύειν ἄναλκις μᾶλλον ἢ μιαιφόνος·
869	αὕτη κατʼ Ἄργος βασιλικὸν τέξει γένος.
870	μακροῦ λόγου δεῖ ταῦτʼ ἐπεξελθεῖν τορῶς.
871	σπορᾶς γε μὴν ἐκ τῆσδε φύσεται θρασὺς
872	τόξοισι κλεινός, ὃς πόνων ἐκ τῶνδʼ ἐμὲ
873	λύσει. τοιόνδε χρησμὸν ἡ παλαιγενὴς
874	μήτηρ ἐμοὶ διῆλθε Τιτανὶς Θέμις·
875	ὅπως δὲ χὤπη, ταῦτα δεῖ μακροῦ λόγου
876	εἰπεῖν, σύ τʼ οὐδὲν ἐκμαθοῦσα κερδανεῖς.
877	ἐλελεῦ ἐλελεῦ,
878	ὑπό μʼ αὖ σφάκελος καὶ φρενοπληγεῖς
879	μανίαι θάλπουσʼ, οἴστρου δʼ ἄρδις
880	χρίει μʼ ἄπυρος·
881	κραδία δὲ φόβῳ φρένα λακτίζει.
882	τροχοδινεῖται δʼ ὄμμαθʼ ἑλίγδην,
883	ἔξω δὲ δρόμου φέρομαι λύσσης
884	πνεύματι μάργῳ, γλώσσης ἀκρατής·
885	θολεροὶ δὲ λόγοι παίουσʼ εἰκῆ
886	στυγνῆς πρὸς κύμασιν ἄτης.
887	ἦ σοφὸς ἦ σοφὸς ἦν ὃς
888	πρῶτος ἐν γνώμᾳ τόδʼ ἐβάστασε καὶ γλώσ-
889	σᾳ διεμυθολόγησεν,
890	ὡς τὸ κηδεῦσαι καθʼ ἑαυτὸν ἀριστεύει μακρῷ,
891	καὶ μήτε τῶν πλούτῳ διαθρυπτομένων
892	μήτε τῶν γέννᾳ μεγαλυνομένων
893	ὄντα χερνήταν ἐραστεῦσαι γάμων.
894	μήποτε μήποτέ μʼ, ὦ
895	πότνιαι Μοῖραι, λεχέων Διὸς εὐνά-
896	τειραν ἴδοισθε πέλουσαν·
897	μηδὲ πλαθείην γαμέτᾳ τινὶ τῶν ἐξ οὐρανοῦ.
898	ταρβῶ γὰρ ἀστεργάνορα παρθενίαν
899	εἰσορῶσʼ Ἰοῦς ἀμαλαπτομέναν
900	δυσπλάνοις Ἥρας ἀλατείαις πόνων.
901	ἐμοὶ δʼ ὅτε μὲν ὁμαλὸς ὁ γάμος,
902	ἄφοβος· οὐ δέδια· μηδὲ κρεισσόνων θεῶν
903	ἔρως ἄφυκτον ὄμμα προσδράκοι με.
904	ἀπόλεμος ὅδε γʼ ὁ πόλεμος, ἄπορα πόριμος·
905	οὐδʼ ἔχω τίς ἂν γενοίμαν.
906	τὰν Διὸς γὰρ οὐχ ὁρῶ
906b	μῆτιν ὅπα φύγοιμʼ ἄν.
907	ἦ μὴν ἔτι Ζεύς, καίπερ αὐθάδης φρενῶν,
908	ἔσται ταπεινός, οἷον ἐξαρτύεται
909	γάμον γαμεῖν, ὃς αὐτὸν ἐκ τυραννίδος
910	θρόνων τʼ ἄιστον ἐκβαλεῖ· πατρὸς δʼ ἀρὰ
911	Κρόνου τότʼ ἤδη παντελῶς κρανθήσεται,
912	ἣν ἐκπίτνων ἠρᾶτο δηναιῶν θρόνων.
913	τοιῶνδε μόχθων ἐκτροπὴν οὐδεὶς θεῶν
914	δύναιτʼ ἂν αὐτῷ πλὴν ἐμοῦ δεῖξαι σαφῶς.
915	ἐγὼ τάδʼ οἶδα χᾦ τρόπῳ. πρὸς ταῦτά νυν
916	θαρσῶν καθήσθω τοῖς πεδαρσίοις κτύποις
917	πιστός, τινάσσων τʼ ἐν χεροῖν πύρπνουν βέλος.
918	οὐδὲν γὰρ αὐτῷ ταῦτʼ ἐπαρκέσει τὸ μὴ οὐ
919	πεσεῖν ἀτίμως πτώματʼ οὐκ ἀνασχετά·
920	τοῖον παλαιστὴν νῦν παρασκευάζεται
921	ἐπʼ αὐτὸς αὑτῷ, δυσμαχώτατον τέρας·
922	ὃς δὴ κεραυνοῦ κρείσσονʼ εὑρήσει φλόγα,
923	βροντῆς θʼ ὑπερβάλλοντα καρτερὸν κτύπον·
924	θαλασσίαν τε γῆς τινάκτειραν νόσον
925	τρίαιναν, αἰχμὴν τὴν Ποσειδῶνος, σκεδᾷ.
926	πταίσας δὲ τῷδε πρὸς κακῷ μαθήσεται
927	ὅσον τό τʼ ἄρχειν καὶ τὸ δουλεύειν δίχα.
928	σύ θην ἃ χρῄζεις, ταῦτʼ ἐπιγλωσσᾷ Διός.
929	ἅπερ τελεῖται, πρὸς δʼ ἃ βούλομαι λέγω.
930	καὶ προσδοκᾶν χρὴ δεσπόσειν Ζηνός τινα;
931	καὶ τῶνδέ γʼ, ἕξει δυσλοφωτέρους πόνους.
932	πῶς δʼ οὐχὶ ταρβεῖς τοιάδʼ ἐκρίπτων ἔπη;
933	τί δʼ ἂν φοβοίμην ᾧ θανεῖν οὐ μόρσιμον;
934	ἀλλʼ ἆθλον ἄν σοι τοῦδʼ ἔτʼ ἀλγίω πόροι.
935	ὁ δʼ οὖν ποιείτω· πάντα προσδοκητά μοι.
936	οἱ προσκυνοῦντες τὴν Ἀδράστειαν σοφοί.
937	σέβου, προσεύχου, θῶπτε τὸν κρατοῦντʼ ἀεί.
938	ἐμοὶ δʼ ἔλασσον Ζηνὸς ἢ μηδὲν μέλει.
939	δράτω, κρατείτω τόνδε τὸν βραχὺν χρόνον,
940	ὅπως θέλει· δαρὸν γὰρ οὐκ ἄρξει θεοῖς.
941	ἀλλʼ εἰσορῶ γὰρ τόνδε τὸν Διὸς τρόχιν,
942	τὸν τοῦ τυράννου τοῦ νέου διάκονον·
943	πάντως τι καινὸν ἀγγελῶν ἐλήλυθεν.
944	σὲ τὸν σοφιστήν, τὸν πικρῶς ὑπέρπικρον,
945	τὸν ἐξαμαρτόντʼ εἰς θεοὺς ἐφημέροις
946	πορόντα τιμάς, τὸν πυρὸς κλέπτην λέγω·
947	πατὴρ ἄνωγέ σʼ οὕστινας κομπεῖς γάμους
948	αὐδᾶν, πρὸς ὧν ἐκεῖνος ἐκπίπτει κράτους.
949	καὶ ταῦτα μέντοι μηδὲν αἰνικτηρίως,
950	ἀλλʼ αὔθʼ ἕκαστα φράζε· μηδέ μοι διπλᾶς
951	ὁδούς, Προμηθεῦ, προσβάλῃς· ὁρᾷς δʼ ὅτι
952	Ζεὺς τοῖς τοιούτοις οὐχὶ μαλθακίζεται.
953	σεμνόστομός γε καὶ φρονήματος πλέως
954	ὁ μῦθός ἐστιν, ὡς θεῶν ὑπηρέτου.
955	νέον νέοι κρατεῖτε καὶ δοκεῖτε δὴ
956	ναίειν ἀπενθῆ πέργαμʼ· οὐκ ἐκ τῶνδʼ ἐγὼ
957	δισσοὺς τυράννους ἐκπεσόντας ᾐσθόμην;
958	τρίτον δὲ τὸν νῦν κοιρανοῦντʼ ἐπόψομαι
959	αἴσχιστα καὶ τάχιστα. μή τί σοι δοκῶ
960	ταρβεῖν ὑποπτήσσειν τε τε τοὺς νέους θεούς;
961	πολλοῦ γε καὶ τοῦ παντὸς ἐλλείπω. σὺ δὲ
962	κέλευθον ἥνπερ ἦλθες ἐγκόνει πάλιν·
963	πεύσῃ γὰρ οὐδὲν ὧν ἀνιστορεῖς ἐμέ.
964	τοιοῖσδε μέντοι καὶ πρὶν αὐθαδίσμασιν
965	ἐς τάσδε σαυτὸν πημονὰς καθώρμισας.
966	τῆς σῆς λατρείας τὴν ἐμὴν δυσπραξίαν,
967	σαφῶς ἐπίστασʼ, οὐκ ἂν ἀλλάξαιμʼ ἐγώ.
968	κρεῖσσον γὰρ οἶμαι τῇδε λατρεύειν πέτρᾳ
969	ἢ πατρὶ φῦναι Ζηνὶ πιστὸν ἄγγελον.
970	οὕτως ὑβρίζειν τοὺς ὑβρίζοντας χρεών.
971	χλιδᾶν ἔοικας τοῖς παροῦσι πράγμασι.
972	χλιδῶ; χλιδῶντας ὧδε τοὺς ἐμοὺς ἐγὼ
973	ἐχθροὺς ἴδοιμι· καὶ σὲ δʼ ἐν τούτοις λέγω.
974	ἦ κἀμὲ γάρ τι συμφοραῖς ἐπαιτιᾷ;
975	ἁπλῷ λόγῳ τοὺς πάντας ἐχθαίρω θεούς,
976	ὅσοι παθόντες εὖ κακοῦσί μʼ ἐκδίκως.
977	κλύω σʼ ἐγὼ μεμηνότʼ οὐ σμικρὰν νόσον.
978	νοσοῖμʼ ἄν, εἰ νόσημα τοὺς ἐχθροὺς στυγεῖν.
979	εἴης φορητὸς οὐκ ἄν, εἰ πράσσοις καλῶς.
980	ὤμοι.
980a	ὤμοι; τόδε Ζεὺς τοὔπος οὐκ ἐπίσταται.
981	ἀλλʼ ἐκδιδάσκει πάνθʼ ὁ γηράσκων χρόνος.
982	καὶ μὴν σύ γʼ οὔπω σωφρονεῖν ἐπίστασαι.
983	σὲ γὰρ προσηύδων οὐκ ἂν ὄνθʼ ὑπηρέτην.
984	ἐρεῖν ἔοικας οὐδὲν ὧν χρῄζει πατήρ.
985	καὶ μὴν ὀφείλων γʼ ἂν τίνοιμʼ αὐτῷ χάριν.
986	ἐκερτόμησας δῆθεν ὡς παῖδʼ ὄντα με.
987	οὐ γὰρ σὺ παῖς τε κἄτι τοῦδʼ ἀνούστερος
988	εἰ προσδοκᾷς ἐμοῦ τι πεύσεσθαι πάρα;
989	οὐκ ἔστιν αἴκισμʼ οὐδὲ μηχάνημʼ ὅτῳ
990	προτρέψεταί με Ζεὺς γεγωνῆσαι τάδε,
991	πρὶν ἂν χαλασθῇ δεσμὰ λυμαντήρια.
992	πρὸς ταῦτα ῥιπτέσθω μὲν αἰθαλοῦσσα φλόξ,
993	λευκοπτέρῳ δὲ νιφάδι καὶ βροντήμασι
994	χθονίοις κυκάτω πάντα καὶ ταρασσέτω.
995	γνάμψει γὰρ οὐδὲν τῶνδέ μʼ ὥστε καὶ φράσαι
996	πρὸς οὗ χρεών νιν ἐκπεσεῖν τυραννίδος.
997	ὅρα νυν εἴ σοι ταῦτʼ ἀρωγὰ φαίνεται.
998	ὦπται πάλαι δὴ καὶ βεβούλευται τάδε.
999	τόλμησον, ὦ μάταιε, τόλμησόν ποτε
1000	πρὸς τὰς παρούσας πημονὰς ὀρθῶς φρονεῖν,
1001	ὀχλεῖς μάτην με κῦμʼ ὅπως παρηγορῶν.
1002	εἰσελθέτω σε μήποθʼ ὡς ἐγὼ Διὸς
1003	γνώμην φοβηθεὶς θηλύνους γενήσομαι,
1004	καὶ λιπαρήσω τὸν μέγα στυγούμενον
1005	γυναικομίμοις ὑπτιάσμασιν χερῶν
1006	λῦσαί με δεσμῶν τῶνδε· τοῦ παντὸς δέω.
1007	λέγων ἔοικα πολλὰ καὶ μάτην ἐρεῖν·
1008	τέγγῃ γὰρ οὐδὲν οὐδὲ μαλθάσσῃ λιταῖς
1009	ἐμαῖς· δακὼν δὲ στόμιον ὡς νεοζυγὴς
1010	πῶλος βιάζῃ καὶ πρὸς ἡνίας μάχῃ.
1011	ἀτὰρ σφοδρύνῃ γʼ ἀσθενεῖ σοφίσματι·
1012	αὐθαδία γὰρ τῷ φρονοῦντι μὴ καλῶς
1013	αὐτὴ καθʼ αὑτὴν οὐδενὸς μεῖζον σθένει.
1014	σκέψαι δʼ, ἐὰν μὴ τοῖς ἐμοῖς πεισθῇς λόγοις,
1015	οἷός σε χειμὼν καὶ κακῶν τρικυμία
1016	ἔπεισʼ ἄφυκτος · πρῶτα μὲν γὰρ ὀκρίδα
1017	φάραγγα βροντῇ καὶ κεραυνίᾳ φλογὶ
1018	πατὴρ σπαράξει τήνδε, καὶ κρύψει δέμας
1019	τὸ σόν, πετραία δʼ ἀγκάλη σε βαστάσει.
1020	μακρὸν δὲ μῆκος ἐκτελευτήσας χρόνου
1021	ἄψορρον ἥξεις εἰς φάος· Διὸς δέ τοί
1022	πτηνὸς κύων, δαφοινὸς αἰετός, λάβρως
1023	διαρταμήσει σώματος μέγα ῥάκος,
1024	ἄκλητος ἕρπων δαιταλεὺς πανήμερος,
1025	κελαινόβρωτον δʼ ἧπαρ ἐκθοινήσεται.
1026	τοιοῦδε μόχθου τέρμα μή τι προσδόκα,
1027	πρὶν ἂν θεῶν τις διάδοχος τῶν σῶν πόνων
1028	φανῇ, θελήσῃ τʼ εἰς ἀναύγητον μολεῖν
1029	Ἅιδην κνεφαῖά τʼ ἀμφὶ Ταρτάρου βάθη.
1030	πρὸς ταῦτα βούλευʼ· ὡς ὅδʼ οὐ πεπλασμένος
1031	ὁ κόμπος, ἀλλὰ καὶ λίαν εἰρημένος ·
1032	ψευδηγορεῖν γὰρ οὐκ ἐπίσταται στόμα
1033	τὸ Δῖον, ἀλλὰ πᾶν ἔπος τελεῖ· σὺ δὲ
1034	πάπταινε καὶ φρόντιζε, μηδʼ αὐθαδίαν
1035	εὐβουλίας ἀμείνονʼ ἡγήσῃ ποτέ.
1036	ἡμῖν μὲν Ἑρμῆς οὐκ ἄκαιρα φαίνεται
1037	λέγειν. ἄνωγε γάρ σε τὴν αὐθαδίαν
1038	μεθέντʼ ἐρευνᾶν τὴν σοφὴν εὐβουλίαν.
1039	πιθοῦ· σοφῷ γὰρ αἰσχρὸν ἐξαμαρτάνειν.
1040	εἰδότι τοί μοι τάσδʼ ἀγγελίας
1041	ὅδʼ ἐθώυξεν· πάσχειν δὲ κακῶς
1042	ἐχθρὸν ὑπʼ ἐχθρῶν οὐδὲν ἀεικές.
1043	πρὸς ταῦτʼ ἐπʼ ἐμοὶ ῥιπτέσθω μὲν
1044	πυρὸς ἀμφήκης βόστρυχος, αἰθὴρ δʼ
1045	ἐρεθιζέσθω βροντῇ σφακέλῳ τʼ
1046	ἀγρίων ἀνέμων· χθόνα δʼ ἐκ πυθμένων
1047	αὐταῖς ῥίζαις πνεῦμα κραδαίνοι,
1048	κῦμα δὲ πόντου τραχεῖ ῥοθίῳ
1049	συγχώσειεν τῶν οὐρανίων
1050	ἄστρων διόδους· εἴς τε κελαινὸν
1051	Τάρταρον ἄρδην ῥίψειε δέμας
1052	τοὐμὸν ἀνάγκης στερραῖς δίναις·
1053	πάντως ἐμέ γʼ οὐ θανατώσει.
1054	τοιάδε μέντοι τῶν φρενοπλήκτων
1055	βουλεύματʼ ἔπη τʼ ἔστιν ἀκοῦσαι.
1056	τί γὰρ ἐλλείπει μὴ οὐ παραπαίειν
1057	ἡ τοῦδʼ εὐχή; τί χαλᾷ μανιῶν;
1058	ἀλλʼ οὖν ὑμεῖς γʼ αἱ πημοσύναις
1059	συγκάμνουσαι ταῖς τοῦδε τόπων
1060	μετά ποι χωρεῖτʼ ἐκ τῶνδε θοῶς,
1061	μὴ φρένας ὑμῶν ἠλιθιώσῃ
1062	βροντῆς μύκημʼ ἀτέραμνον.
1063	ἄλλο τι φώνει καὶ παραμυθοῦ μʼ
1064	ὅ τι καὶ πείσεις· οὐ γὰρ δή που
1065	τοῦτό γε τλητὸν παρέσυρας ἔπος.
1066	πῶς με κελεύεις κακότητʼ ἀσκεῖν;
1067	μετὰ τοῦδʼ ὅ τι χρὴ πάσχειν ἐθέλω·
1068	τοὺς προδότας γὰρ μισεῖν ἔμαθον,
1069	κοὐκ ἔστι νόσος
1070	τῆσδʼ ἥντινʼ ἀπέπτυσα μᾶλλον.
1071	ἀλλʼ οὖν μέμνησθʼ ἁγὼ προλέγω
1072	μηδὲ πρὸς ἄτης θηραθεῖσαι
1073	μέμψησθε τύχην, μηδέ ποτʼ εἴπηθʼ
1074	ὡς Ζεὺς ὑμᾶς εἰς ἀπρόοπτον
1075	πῆμʼ εἰσέβαλεν· μὴ δῆτʼ αὐταὶ δʼ
1076	ὑμᾶς αὐτάς. εἰδυῖαι γὰρ
1077	κοὐκ ἐξαίφνης οὐδὲ λαθραίως
1078	εἰς ἀπέρατον δίκτυον ἄτης
1079	ἐμπλεχθήσεσθʼ ὑπʼ ἀνοίας.
1080	καὶ μὴν ἔργῳ κοὐκέτι μύθῳ
1081	χθὼν σεσάλευται·
1082	βρυχία δʼ ἠχὼ παραμυκᾶται
1083	βροντῆς, ἕλικες δʼ ἐκλάμπουσι
1084	στεροπῆς ζάπυροι, στρόμβοι δὲ κόνιν
1085	εἱλίσσουσι· σκιρτᾷ δʼ ἀνέμων
1086	πνεύματα πάντων εἰς ἄλληλα
1087	στάσιν ἀντίπνουν ἀποδεικνύμενα·
1088	ξυντετάρακται δʼ αἰθὴρ πόντῳ.
1089	τοιάδʼ ἐπʼ ἐμοὶ ῥιπὴ Διόθεν
1090	τεύχουσα φόβον στείχει φανερῶς.
